{
  "schema_version": 1,
  "campaign_id": "campaign_navigation_v7.7",
  "name": "Navigation v7.7 candidate validation (local registry)",
  "description": "Deploy Navigation v7.7 as candidate (shadow), verify logs, then promote. Select deployment target vehicle(s) in the dashboard before Validate.",
  "status": "draft",
  "created_at": "2026-06-01T12:00:00Z",
  "feature": "Navigation",
  "target_version": "v7.7",
  "target_role": "candidate",
  "legacy_slot": "B",
  "package_id": "Navigation_v7.7",
  "package_path": "deploy/packages/Navigation/v7.7",
  "manifest_path": "deploy/packages/Navigation/v7.7/manifest.json",
  "docker_image": "localhost:5000/sdv/navigation-feature:v7.7",
  "artifact_type": "docker_image",
  "rollout_policy_id": "policy_single_car_candidate_manual_promote_nav_v7.7",
  "target_selector": {
    "scope": "vehicle",
    "vehicle_ids": [
      "car_4",
      "car_5",
      "car_6",
      "car_7",
      "car_8"
    ]
  },
  "safety_requirements": {
    "respect_kill_switch": true,
    "require_ota_ready": true,
    "require_driver_approval": true
  },
  "execution_options": {
    "sync_config": true,
    "no_defer_native": true
  },
  "docker_runtime": {
    "enabled": true,
    "candidate": {
      "mode": "candidate",
      "pull_policy": "missing"
    },
    "promote": {
      "mode": "promote",
      "policy": "manual",
      "separate_run_required": true
    }
  },
  "approval_required": true
}
